Original Text,Translated to English,Topic
In terms of the satisfaction survey - had to give 'average' response as I have not yet looked at the areas to be rated,In terms of the satisfaction survey - had to give 'average' response as I have not yet looked at the areas to be rated,website
Make it more user friendly. Look at other modern companies/major news outlets and how their websites work. Use the available examples from the internet to enhance and modernise all EU related web pages. Thank you,Make it more user friendly. Look at other modern companies/major news outlets and how their websites work. Use the available examples from the internet to enhance and modernise all EU related web pages. Thank you,website
x,x,nothing
"caricate i documenti attuali, perchè sono un po' datati, per es. la carta di identità del 2023.","upload the current documents, because they are a little dated, e.g. The identity card of 2023.",document
it is fine.,it is fine.,opinion
-,-,nothing
traduisez tout dans toutes les langues de l'Union avant publication d'un seul texte ou document. En favorisant une langue par rapport aux autres vous portez préjudice à tous les citoyens de l'Union qui ne maitrisent pas ou pas suffisamment cette langue. Cela nuit aux droits des citoyens.,Translate everything in all languages ​​of the Union before publication of a single text or document. By promoting a language in relation to others you prejudice all the citizens of the Union who do not master this language or not. This affects the rights of citizens.,translation
Sometimes it's difficult to find documents; I appreciate that there is a search function but if possible perhaps add a tab which lists (broadly) by subject matter,Sometimes it's difficult to find documents; I appreciate that there is a search function but if possible perhaps add a tab which lists (broadly) by subject matter,search engine
Traduction en Français des communiqués de presse,French translation of press releases,translation
"keep it simple, älkää tehkö jenkkihässäköitä. Ne on syvältä.","Keep it simple, don't make Yankee hits. They are deep.",information
Have a reduced text/simplified and or a infographic to mack clear/speed up understanding of a person(s) not fimilar to all the detail. (obviously including a note to sate it is simplified) I looked up the web site to find out the latest regarding F-gases.,Have a reduced text/simplified and or a infographic to mack clear/speed up understanding of a person(s) not fimilar to all the detail. (obviously including a note to sate it is simplified) I looked up the web site to find out the latest regarding F-gases.,opinion
No,No,nothing
Bei einer so großen und wichtigen Sache wie dem Europarat gibt es keine Barrierefreiheit?! Mich wundert zudem die anscheinend ausschließliche Verwendung des generischen Maskulinums. Zeitgemäß ist das nicht.,"With such a big and important thing as the Council of Europe, there is no accessibility?! I am also surprised by the apparently exclusive use of the generic masculine. This is not contemporary.",opinion
No. Everything looks good.,No. Everything looks good.,opinion
"Ναι αλλά ίσως ο χώρος εδώ να είναι περιορισμένος και η ""ανωνυμία"" σε συνδυασμό με την ,κατα τη γνώμη μου,ευρύτητα του αντικειμένου να απαιτεί καλύτερη δομή του ερωτηματολογίου (αίσθηση επισκέπτη Ευρωπαίου πολίτη ότι η γραφειοκρατική διαδικασία επεξεργασίας προτάσεων όχι μόνον για τον Ιστότοπο αλλά για όλα τα θέματα με την ΕΕ και τα Θεσμικά όργανά της να μην ""μπλοκάρουν"" την άμεση ανταπόκριση στα όποια ερωτήματα και παρατηρήσεις .","Yes but maybe the space here may be limited and the ""anonymity"" combined with, in my opinion, the extent of the object requires a better structure of the questionnaire (a visitor to a European citizen that the bureaucratic processing process not only for the site but For all issues with the EU and its institutions not to ""block"" the immediate response to any questions and observations.",opinion
Nie zaczynać informacji o Radzie od ankiety.,Do not start information about the council with a survey.,information
prado n'est pas à jour. Donc il n'est pas toujours simple de travailler avec cet outil,Prado is not up to date. So it is not always easy to work with this tool,document
"misschien is het handig om iets minder met 'plain text' te werken, maar ook visuele navigatie op de website te ondersteunen door verschillende inhoudelijke elementen in blokken te visualiseren.","Perhaps it is useful to work a little less with 'Plain Text', but also to support visual navigation on the website by visualizing different substantive elements in blocks.",website
nie,NO,nothing
No for now -,No for now -,nothing
οχι,no,nothing
"Dokumente, Pässe und ID-Card könnten besser mit den Beschreibungen und Erkenntnissen der EU-Länder verknüpft werden. Eine fließende Vergleichsmöglichkeit ist schwierig.","Documents, passes and ID card could be better linked to the descriptions and knowledge of the EU countries. A smooth comparison is difficult.",document
Többet kell tenni,More to do more,nothing
RAS,RAS,nothing
"Adding more information about COREPER meetings, for example.","Adding more information about COREPER meetings, for example.",information
"Cover more EU and outside of EU news. I'd like to read news from a trusted source not whaterver ""no-name"" newspaper or fascist social media ""creator"". Thanks","Cover more EU and outside of EU news. I'd like to read news from a trusted source not whaterver ""no-name"" newspaper or fascist social media ""creator"". Thanks",opinion
not on a first visit,not on a first visit,nothing
Zatiaľ nie,Not yet,nothing
"Ne, neturiu jokių pastabų","No, I have no comments",comment
"Nehéz kérdés. Esetleg nagyon rövid, kivonatos információk a napi sarkalatos témákban. Pl live tracking Magyarország jogállamisági kifogásokkal kapcsolatos lépésekről. Akár egy sima %-os mutató kirakása. Pl 37%-ban hoztak lépéseket + 8% mutattak be terveket amik megvalósításra várnak. A felületes szemlélők helyzetértékelését segítheti...","Difficult question. Perhaps very short, extractive information on daily cornerstones. Pl Live Tracking Hungary on the rule of law objections. Like a smooth %index. Pl 37% took steps + 8% were presented plans to be realized. Superficial observers can help assess the situation ...",information
"Yes, with the weaponisation of Neuroscience in developing brain warfare tactics. There ought to be more locations to securely and quickly provide tid-bits/lengthy reports on terrorist activities. It is better to have information archived which can later be used to reconstruct a time-line, than to reject offers based on... Lack of ?","Yes, with the weaponisation of Neuroscience in developing brain warfare tactics. There ought to be more locations to securely and quickly provide tid-bits/lengthy reports on terrorist activities. It is better to have information archived which can later be used to reconstruct a time-line, than to reject offers based on... Lack of ?",search engine
Never showed up in my search before. The article I read was very informative.,Never showed up in my search before. The article I read was very informative.,search engine
"Not yet used to visiting the site. Surprised it goes to English as default language, after Brexit it is odd... Will revert with suggestions!","Not yet used to visiting the site. Surprised it goes to English as default language, after Brexit it is odd... Will revert with suggestions!",translation
I have no comments for now but your information is valid even for countries that aren't part of the EU,I have no comments for now but your information is valid even for countries that aren't part of the EU,comment
nej inte ännu,no not yet,nothing
nan,,nothing
"Nu, nu am, site-ul Consiliului este destul de accesibil și util.","No, I don't have, the council's website is quite accessible and useful.",website
Nie mam opini,I have no opinion,opinion
yes,yes,nothing
Incluyan informacion relacionada con la situacion economica politica y social de los paises que integran la org.,Include information related to the political and social economic situation of the countries that make up the org.,information
možno viac spopularizovať stránku,Perhaps more popularize the page,opinion
Nog niet,Not yet,nothing
fiches thématiques et pédagogiques (multi)bilingues.,Thematic and educational (multi) bilingual sheets.,search engine
"Habe die Website für eine Präsentation genutzt und war sehr zufrieden und habe viele Informationen gefunden, die ich ansonsten nur mit viel Mühe gefunden hätte.",I used the website for a presentation and was very satisfied and found a lot of information that I would otherwise have found with a lot of effort.,website
No nothing yet,No nothing yet,nothing
Nie,NO,nothing
ne,it is,nothing
"Mr. Borrell's blog is really great and I appreciate access to his opinion. It means people know where he's coming from and this creates trust. I would if EU members states could get support for their Foreign Ministers' Website to have a website and blog just like the one Mr. Borrell has, with up to date with what's going on and then they can also have a direct link into the EEAS as well. Thank you","Mr. Borrell's blog is really great and I appreciate access to his opinion. It means people know where he's coming from and this creates trust. I would if EU members states could get support for their Foreign Ministers' Website to have a website and blog just like the one Mr. Borrell has, with up to date with what's going on and then they can also have a direct link into the EEAS as well. Thank you",website
Moins de javascript.,Less JavaScript.,opinion
"Större font på texten, jag tycker den är lite för liten.","Bigger font on the text, I think it's a little too small.",opinion
Tehdä siitä houkuttelevampi,Make it more attractive,opinion
Nein,No,nothing
NONE,NONE,nothing
Funkar fint som den är.,Works fine as it is.,opinion
Den här enkäten kom för snabbt. Jag hann knappt vara inne och få en uppfattning.,This survey came too fast. I barely had to be inside and get an idea.,website
Please give more useful links,Please give more useful links,opinion
"I realise that the materials (videos, specifically) are doubtless on YouTube, but having downloadable video files for teachers would be useful. Mainly because I do not use a VPN on my work laptop, and I would need to use a stream-ripper in order to display any of your videos in my classroom.","I realise that the materials (videos, specifically) are doubtless on YouTube, but having downloadable video files for teachers would be useful. Mainly because I do not use a VPN on my work laptop, and I would need to use a stream-ripper in order to display any of your videos in my classroom.",opinion
Am primit un mail sa platesc ca sa primesc bitcoint,I got an email to pay to receive bitcoch,email
I don´t know in this moment,I don´t know in this moment,nothing
Mettez plus en avant les recommandations du conseil par pays et expliquez clairement leur impact,Put more forward the advice recommendations by country and clearly explain their impact,document
Ne,It is,nothing
Alguna vinculación específica con los avances en los sistemas agrarios. Exportaciones e hidroponia.,Some specific link with advances in agricultural systems. Exports and Hydropony.,opinion
No,No,nothing
Documenten waarop besluiten berusten. Bvb onderzoeksresultaten (gelinkt),Documents on which decisions are based. Eg research results (linked),document
"Simplifier et ou représenter les paroles par les images, graphiques. Pour que cela plus compréhensif et accessible à tous","Simplify and or represent the lyrics by images, graphics. To make it more understanding and accessible to all",opinion
"Dokumenty głośne w telewizji, np pakt migracyjny powinien być łatwo dostępny.","Documents loud on television, e.g. a migration pact should be easily available.",document
Newsletter,Newsletter,website
nan,Na,nothing
Daug naudingos informacijos. Ačiū,A lot of useful information. Thank you,information
"využívám k dohledání pravosti čísel dokladu totožnosti, hodil by se nějaký filtr, kam bych číslo mohla pouze zadat a nechat si vyjet např. možné země, kde takový doklad může existovat","I use to find the authenticity of the identity documents, a filter would be useful where I could only enter the number and let, for example, a possible country where such a document can exist",document
În opinia mea funcționează bine,In my opinion it works well,opinion
habe noch keine Meinung bilden können,I haven't been able to form an opinion yet,opinion
Si,And,nothing
Passt,Fits,opinion
"Je možno všechna tato předsevzetí Rady Evropské unie dodržet i v jednotlivých státech, členech EU, když je v podstatě upřednostňován právní systém jednotlivých zemí před právním systémem Soudního dvora Evropské unie????? Nedala by se tato situace v případě nutnosti nějak změnit? Zajímalo by mne, jak můžeme ""vybudovat dostatečnou úroveň kapacity, aby zaručila svůj hospodářský a sociální blahobyt"", když máme jiná pravidla nejenom právní, ale i lidská? Vaše doporučení jsou obdivuhodná, ovšem s dalším prosazováním Vašich doporučených pravidel souvisejících s právním systémem jednotlivých zemí, mohou být tato doporučení Evropské rady bezpředmětná. A člověk může zažívat stav bezpráví. Vždyť máme problém v naší společnosti například s úctou k člověku a jeho lidským právům. Jak jsem pochopila ze své zkušenosti, v naší zemi se lidská práva, zejména právo na sebeurčení, kdy i trochu jiný klobouk může být podezřelý :-) moc nerespektují. Právo na soukromí v oblasti zdraví se rovněž nerespektuje. Naopak mi připadá, že kvůli prozrazení lékařského tajemství dochází ke stigmatizaci člověka a k následnému přehlížejícímu pohledu jiných lidí vůči těmto slabším, citlivějším lidem, jež častěji končí v rukou odborníků než lidé podobní psychopatům a jejich bezcitnosti, lidé s chybějící sebereflexí, lidé trochu primitivnějšího myšlení, jež nesouvisí s IQ ale s EQ, to znamená primitivnější myšlení bez schopnosti empatie vůči jiným lidem, zejména těm neprávem stigmatizovaným. V naší zemi chybí dostatečná úroveň v komunikaci mezi lidmi, jež bývá založena na úctě, vzájemnému respektu. Úroveň komunikace jež možná souvisí s absencí víry ve vyšší sílu, víry v Boha. Přestože pomluva je trestný čin, je hypoteticky možno záměrně zlikvidovat člověka právě ""repeat, repeat repeat"" pomluvou.","It is possible to comply with all these resolutions of the Council of the European Union in individual countries, EU members, when the legal system of individual countries is essentially preference to the legal system of the Court of Justice of the European Union ????? Could this situation not change somehow if necessary? I wonder how we can ""build a sufficient level of capacity to guarantee our economic and social prosperity"" when we have other rules not only legal but also human? Your recommendations are admirable, but with further promotion of your recommended rules related to the legal system of individual countries, these recommendations of the European Council may be irrelevant. And one can experience the state of injustice. After all, we have a problem in our society, for example, with respect for man and his human rights. As I understood from my experience, in our country human rights, especially the right to self-determination, when even a slightly different hat can be suspicious :-) They do not respect much. The right to health in the field of health is also not respected. On the contrary, it seems to me that, due to the disclosure of medical secrets, there is a stigmatization of man and the subsequent overlooking of other people towards these weaker, more sensitive people who end up in the hands of experts than people similar to psychopaths and their heartlessness, people with missing self -reflection, people a little more primitive thinking, people, people, people a little more primitive, which is not related to IQ but to EQ, that is, more primitive thinking without the ability of empathy towards other people, especially those wrongly stigmatized. In our country there is a sufficient level of communication between people, which is based on respect, mutual respect. The level of communication may be related to the absence of faith in higher strength, faith in God. Although the defamation is a crime, it is hypothetically possible to deliberately destroy a person just ""repeat, repeat repet"" by defamation.",opinion
MIGLIORARE LA GRAFICA: -METTERE UNO SFONDO COLORATO.,Improve the graphics: -Menous a colorful background.,search engine
Nahh all good chief,Nahh all good chief,opinion
"повече ясна, збита, конкретна и специфична информация по-различните теми","More clear, nit, specific and specific information different topics",information
No comment.,No comment.,comment
Inserire un organigramma con dipendenze gerarchiche tra i vari Organi Istituzionali.,Insert a organization chart with hierarchical addictions between the various institutional bodies.,opinion
Nie,NO,nothing
No,No,nothing
la vérité sur les lois qui nous gouvernent,The truth about the laws that govern us,opinion
Concursuri,competitions,opinion
no,no,nothing
"Cei care conduc Romania au nevoie de cateva principii elementare ale democratiei, incl. alegerea primarilor in 2 tururi de scrutin. Nu intr-un singur tur, cum se intampla de cativa ani.","Those who lead Romania need some elementary principles of democracy, incl. Choosing mayors in 2 elections. Not in one round, as for several years.",opinion
"Soms heb ik het gevoel dat het nogal bombastisch over komt. Veel mooie en dure woorden, die niet voor iedereen helder zijn. Europa moet 'dichter' bij de burger.",Sometimes I feel that it is quite bombastic. Many beautiful and expensive words that are not clear to everyone. Europe must be 'poet' with the citizen.,opinion
NON,NON,nothing
Nu,Not,nothing
"Les charges de responsabilités des gouvernés européen sur lanceur d' alerte indicateur des services des renseignements mise à mort en France pour ses droits financiers volés sous la volonté de mercenaires employés dans les structures administratives françaises, et par des tiers ramifications francais complice dans les instances européennes .","The responsibilities of European governed European governed launcher indicator of the information services put to death in France for its financial rights stolen under the will of mercenaries employed in French administrative structures, and by third parties French accomplice in European bodies .",opinion
neviem,I do not know,nothing
"No, thanks.","No, thanks.",nothing
Nein,No,nothing
I would like to find other services you may have for Africans. So next time I would like to see other Countries from the other continents.,I would like to find other services you may have for Africans. So next time I would like to see other Countries from the other continents.,document
Is very important for me. And easy to understand and use.,Is very important for me. And easy to understand and use.,document
Nee,Nee,nothing
Посещавам го за пръв път и не мога да направя коментар или да дам препоръка.,I visit it for the first time and cannot make a comment or make a recommendation.,comment
Einfache Sprache für einfache Menschen,Simple language for simple people,translation
La finestra per il sondaggio dovrebbe apparire qualche minuto dopo per dare la possibilità di leggere prima quello che si stava cercando e poi fare il sondaggio. Mi è stato chiesto subito di fare il sondaggio ma non ho ancora avuto modo di consultare bene la pagina.,The survey window should appear a few minutes later to give the opportunity to read first what was looking for and then do the survey. I was immediately asked to do the survey but I have not yet had the opportunity to consult the page well.,nothing
No comments,No comments,comment
nu am,I do not have,nothing
Rozwiązać radę,Resolve the advice,opinion
Hope many things to learn,Hope many things to learn,opinion
Nein,No,nothing
sa fiti foarte responsabili pentru tot ce transmiteti,be very responsible for everything you transmit,opinion
No,No,nothing
"No, I don't have a comment or suggestion in this moment. It's the my first time in this website.","No, I don't have a comment or suggestion in this moment. It's the my first time in this website.",suggestion
Keine,No,nothing
Nein,No,nothing
"Per me che sono un autodidatta nell'utilizzo della digitalizzazione, forse qualche miglioramento nel rendere maggiormente facilitante la navigazione del sito. Comunque un SINCERO GRAZIE","For me who are a self -taught in the use of digitization, perhaps some improvement in making the site navigation more facilitating. However a sincere thanks",opinion
noch nicht,not yet,nothing
"Es wäre hilfreich, wenn bei Besuchen, die keine Gruppengröße erreichen, mehrere Personen gleichzeitig gebucht werden könnten // It would be helpful if, for visits, multiple persons could be booked at the same time.","It would be helpful if visits that do not reach group size could be booked at the same time // It would be helpful if, for visits, multiple persons could be booked at the same time.",nothing
Lo conosciamo solo adesso,We only know him now,nothing
Nie,NO,nothing
"Ganz Europa muss bessere Informationen erhalten, damit Rechtsradikale gestoppt werden können",All of Europe must receive better information so that right -wing radicals can be stopped,search engine
do what you can,do what you can,nothing
Nie,NO,nothing
"Mr. Charles Yves Jean Ghislaine Michel did not answer the question of the journalist in Granada, so then let me ask again: Why has EU kept silence about the illegal occupation of Karabag for 30 years? You are all so hypocrite.","Mr. Charles Yves Jean Ghislaine Michel did not answer the question of the journalist in Granada, so then let me ask again: Why has EU kept silence about the illegal occupation of Karabag for 30 years? You are all so hypocrite.",opinion
Nie,NO,nothing
no,no,nothing
"Ce qui me perturbe ce sont les dates de ""sorties"", délivrance des pièces d'identités . Certaines pièces d'identités de coin peut-être reculées ne semblent pas avoir les mêmes dates de délivrance","What disrupts me are the dates of ""outings"", deliverance of identity pieces. Certain parts of corner identities perhaps remote do not seem to have the same deliverance dates",document
L'internaute doit subir une brève formation de l'utilisation de ce site web . Une option facultative !,The user must undergo a brief training in using this website. An optional option!,website
sieht gut aus!,looks good!,nothing
Nincs,There is no,nothing
You can start by adding the Turkish language option.,You can start by adding the Turkish language option.,translation
nie,NO,nothing
Nein,No,nothing
Inga särskilda just nu,No special right now,opinion
No,No,nothing
Sötét téma jó lenne,Dark theme would be good,opinion
Prvi obisk je bil prijeten.,The first visit was enjoyable.,nothing
"Die Website sollte so aufgebaut werden, dass sie intuitiv verstanden wird. die FAQ Liste ist zu lang - fassen Sie Punkte zusammen oder bilden Sie Themenblöcke",The website should be built up in such a way that it is intuitively understood. The FAQ list is too long - summarize points or form theme blocks,website
to say the truth I do not yet know the Council's website well enough to give any suggestions at this point in time,to say the truth I do not yet know the Council's website well enough to give any suggestions at this point in time,suggestion
Come si fa a pensare ad uno strumento per la pace spendendo soldi per le armi e le questioni militari?,How do you think of a tool for peace by spending money on weapons and military issues?,opinion
"Es gibt Personendatenseiten die aus Papier sind und andere wie oft bei neueren Pässen, die eine Plastikbeschichtung haben. Auf die neuen lassen sich gut infektiöse Lösungen auftragen.",There are personal dates that are made of paper and others like often with newer passes that have a plastic coating. Infectious solutions can be applied to the new ones.,opinion
Republica Moldova trebuie să adere la UE cat mai curând,The Republic of Moldova must adhere to the EU as soon as possible,document
"Poner en la entrada lo más importante, prioritario y relevante para el usuario y las últimas noticias respecto Ucrania.","Put the most important, priority and relevant to the entrance for the user and the latest news regarding Ukraine.",opinion
"It is great. But I would say: use more graphic and infographics ( for easy acessible, immediate understanding of the message ).","It is great. But I would say: use more graphic and infographics ( for easy acessible, immediate understanding of the message ).",opinion
"Da, am multe, pe care le voi trimite prin e-mail grupurilor parlamentare din Romania, sa vi le transmita, aici nefiind spatiu suficient ( cred).","Yes, I have many, which I will send by e-mail to the parliamentary groups in Romania, to transmit them, here not enough space (I think).",email
nadaljujte z delom,Continue to work,nothing
Copier des sites semblables qui marchent.,Copy similar sites that work.,opinion
