Original Text,Translated to English,Topic
Ninguna,None,nothing
Przydałoby się więcej informacji na temat rodzaju zabezpieczeń dokumentów badz opis jak weryfikować autentyczność konkretnego dokumentu,It would be more important to be more information on the type of security of documents or a description of how to verify the authenticity of a specific document,document
If made easy,If made easy,document
Nein,No,nothing
Id like better and faster updates on official documents renewals.,Id like better and faster updates on official documents renewals.,document
I don't have experience to be shared yet but In a near future It will be different,I don't have experience to be shared yet but In a near future It will be different,opinion
Samo jako,Just very much,website
"nope aber macht bitte döner wieder auf 5 euro, danke.","Nope, however, please make doners to 5 euros again, thanks.",document
D kdj,D kdj,nothing
Nu,Not,nothing
Nope,Nope,comment
proszę uaktualnić dane o nowy paszport ukraiński,Please update the data for a new Ukrainian passport,passport
No,No,nothing
"Vijesti iz Palestine nedostaju ... Odobravate li stradanje naroda u Palestini, nađite način da spasite narod","Palestine news is missing ... Do you approve the suffering of the people in Palestine, find a way to save the people",opinion
a Prado felületen a specimeneket frissíteni kell,Specimen should be updated on the Prado interface,document
None,None,nothing
I am a migrant,I am a migrant,information
Não,No,nothing
Non,Non,nothing
NON,NON,nothing
Yes,Yes,nothing
Gracias por colaborar con la seguridad internacional. Algunos países no tenemos modelos de pasaportes.,Thanks for collaborating with international security. Some countries do not have passport models.,passport
Nie,NO,nothing
no,no,nothing
"Buongiorno, nella sezione PRADO inserire una mail di riferimento sulla quale potersi appoggiare in caso di bisogno o accertamento piu' approfondito. La mail che c'è, pur avendo scritto piu' volte, non si ha risposta. Grazie","Good morning, in the Prado section insert a reference email on which to be able to support yourself in case of more in -depth need or assessment. The email that is there, despite having written several times, is no answer. Thank you",email
Good,Good,nothing
"More information accessibility, but I understand the limitations.","More information accessibility, but I understand the limitations.",information
DESEARIA QUE HUBIERA MAS VIDEOS EXPLICATIVOS DE LA UNION EUROPEA Y ZONA EURO,I wish there were more explanatory videos of the European Union and EURO,opinion
Aucune pour l'instant,None for the moment,nothing
Tópicos de cada tema que o site aborda,Topics of each theme that the site addresses,opinion
Erittäin hyvä sivusto.,Very good site.,opinion
No,No,nothing
Basic information on home page. Explain clearly the institution and function. And details how it fits in to the EU system,Basic information on home page. Explain clearly the institution and function. And details how it fits in to the EU system,opinion
non,non,nothing
"No tengo comentario todavía, no he explorado toda la página","I have no comment, I have not explored the entire page",comment
Je ne sais pas ?,I don't know ?,nothing
"Auf der Seite Mitglieder des Europäischen Rates fehlt mir eine email Adresse, um den Mitgliedern direkt zu schreiben","On the page members of the European Council page, I lack an email address to write the members directly",email
"stručnost,popis,chovaní","brevity, description, breeding",document
Πιο αναλυτικές ανακοινώσεις,More detailed announcements,information
No,No,nothing
no,no,nothing
Ottimo lavoro e conltabile normalmente,Great job and uncable normally,opinion
Vanno indicati gli indirizzi e-mail del Segretario Generale della Commissione Europea.,The e-mail addresses of the European Commission Secretary General must be indicated.,email
Tutte le pagine (comprese le immagini e le didascalie) devono essere disponibili in tutte le 24 lingue ufficiali.,All pages (including images and captions) must be available in all 24 official languages.,translation
"RAS ! de toute façon , l'avis des citoyens ne compte pas pour UE !!!!!!!","RAS! Anyway, the opinion of citizens does not count for EU !!!!!!!",opinion
What makes the Council's website particularly complex is the fact that the EU is complex. A few explainers for those of us who don't 'live the EU' every day would help immensely in navigating the website.,What makes the Council's website particularly complex is the fact that the EU is complex. A few explainers for those of us who don't 'live the EU' every day would help immensely in navigating the website.,website
per adesso no,not now,nothing
Veebilehel liikumist lihtsustavad alati hästi töötavad otsingumootorid.,Moving on the website is always facilitated by well -running search engines.,search engine
Que los estados miembros den más información a sus ciudadanos de todas las directivas y reglamentos que se aprueban y sus consecuencias. Apenas sabemos lo que se hace en Europa y la realidad es que es mucho más importante de los que se aprueba en los parlamentos nacionales,That the Member States give more information to their citizens of all directives and regulations that are approved and their consequences. We barely know what is done in Europe and the reality is that it is much more important than those approved in national parliaments,information
not really - maybe a summary page of breaking legislation could be more organised,not really - maybe a summary page of breaking legislation could be more organised,opinion
"NON HO DATO ALCUNA RISPOSTA A PRADO, PERCHè NON SO COSA POSSA VOLER DIRE NEL CONTESTO DI QUESTA INCHIESTA. SE TRATTASI NON DEL MUSEO, MA DI UNA SPECIALE FUNZIONE DEL CONSIGLIO, POSTRESTE SPEIGARLO MEGLIO","I have not given any response to Prado, because I don't know what it may mean in the context of this investigation. If it is not the museum, but of a special function of the Council, you will postpone it better",search engine
"très lisible, facile d'utilisation, rien à changer pour ma part, dans ce que j'ai pu voir jusqu'à présent","Very readable, easy to use, nothing to change for my part, in what I have seen so far",document
I am confortable using the website,I am confortable using the website,website
"Alle Seiten auch als PDF (Daten reduziert ohne Grafiken) zum Download anbieten, ähnlich den Pressemitteilungen. Das fehlt zB bei den Eurogruppen-Webseiten zu den ""Hauptergebnissen"" der Sitzungen","Also offer all pages as a PDF (data reduced without graphics) for download, similar to the press releases. This is missing, for example, in the euro group websites for the ""main results"" of the meetings",website
nej,her,nothing
nein,no,nothing
nie,NO,nothing
Din punctul meu de vedere e bun asa,From my point of view it is good like that,opinion
Nu,Not,nothing
leichteres Nachschlagen von Abkürzungen und/oder sooft wie möglich im Text die Abkürzung ausschreiben,Lighter look up abbreviations and/or so often as possible in the text the abbreviation write out the abbreviation,opinion
"Me gustaría que los temas estuviesen mejor agrupados. Me gustaría que los resúmenes fuesen mas estructurados y sencillos, porque a veces son difíciles de leer.","I would like the issues to be better grouped. I would like the summaries to be more structured and simple, because sometimes they are difficult to read.",search engine
"De website is duidelijk gemaakt voor specialisten in EU, Civ, CivMil en Mil aangelegenheden","The website has been made clear to specialists in EU, CIV, CIVMIL and MIL matters",website
Lägg ut satellitbilder på utsläpp i atmosfären.,Post satellite images on emissions in the atmosphere.,opinion
Nie mam,I don't have,nothing
"C'è il motore di ricerca generale? Forse sì, ma io non l'ho trovato.","Is there the general search engine? Maybe yes, but I didn't find it.",search engine
I hope database could be more easily to use,I hope database could be more easily to use,document
"Mai multe analize, rapoarte, etc. care sa ofere informații calitative despre evoluțiile din UE.","More analyzes, reports, etc. which will provide qualitative information about EU developments.",information
Potenziare le informazioni sulle opportunità di lavoro,Enhance information on job opportunities,information
No tengo sugerencias aunque me gustaria conocer datos sobre investigacion,I have no suggestions although I would like to know data on research,suggestion
"Bem, a minha opinião é paciência com qualquer pessoa que navega sobre vossa página web.","Well, my opinion is patience with anyone who browses your web page.",opinion
Auf die Existenz hinweisen.,Indicate the existence.,opinion
E prea sobru constituită structura info.,The info structure is too sober.,opinion
??? wenn man das erste mal hier schaut ???? weiss nicht,??? If you look here for the first time ???? I do not know,nothing
più semplificato per i non esperti,more simplified for non -experts,opinion
Contacts (at least mail address) have to be easy to find,Contacts (at least mail address) have to be easy to find,email
Nein,No,nothing
Cerco dati sulla rotta balcanica dei migranti. Conto che le informazioni che vi trovo siano affidabili.,I am looking for data on the Balkan route of migrants. I realize that the information I find is reliable.,information
no,no,nothing
Climate change survey of scientists What's happen on earth to climate change to feature? H2O warrning for earth,Climate change survey of scientists What's happen on earth to climate change to feature? H2O warrning for earth,website
Utilizar un lenguaje más coloquial.,Use a more colloquial language.,translation
Quitar lo que no esté e vigor o que aparezca que está derogado en un sitio visible en cuanto de consulta,Remove what is not vigorous or that it appears that it is repealed in a visible site as soon as possible,opinion
Sie sollten die Wahrheit nicht verdrehen.,You shouldn't twist the truth.,opinion
Neturiu.,I have no.,nothing
Să fie pe modul negru,Be on the black mode,website
ΟΧΙ ΠΡΟΣ ΤΟ ΠΑΡΟΝ,NO TO THE PARON,opinion
Derzeit nicht. Vielleicht bei der nächsten Nutzung...,Currently not. Maybe the next use ...,opinion
-,-,nothing
"Make it more revelent, to the ordinary citizens of the EU","Make it more revelent, to the ordinary citizens of the EU",opinion
"Piemēram, informācijā par Eiropas izglītības telpu būtu jāiekļauj arī informācija par kvantitatīvajiem mērķiem Eiropas izglītības telpai līdz 2023. gadam","For example, information on the European Education Space should also include information on quantitative goals for the European Education Space until 2023",information
ΚΛΥΤΕΡΗ ΜΗΧΑΝΗ ΑΝΑΖΗΤΗΣ ΕΓΓΡΑΦΩΝ,CLOSE SEARCH MACHINE,search engine
"Prosím, nemeňte vzhľad a funkcie stránky každý mesiac",Please do not change the appearance and features of the page every month,opinion
Presnejšie informácie - kedy - kde - ako...,More precise information - when - where - how ...,information
en bas de page du site web est ecrit: 'contact' mais personne repond au e-mail,At the bottom of the website is written: 'contact' but no one responds to the e-mail,email
"Zatiaľ nie, som tu prvýkrát.","Not yet, I'm here for the first time.",nothing
"Nezabýval bych se vůbec stránkami, ale edukací občanů zemí, prezentací institucí a jejich ""marketingem"". Desinnformátorů jsou kvanta, ale o EU je slyšet málo. Na stránky jsem se podíval z důvodu, že jsem nevěděl, co je COREPER II. Jehož zástupcem za ČR byl Martin Povejšil, který obdržel včera vyznamenání. Informaci o COREPER II jsem našel dnes na stránkách MZV ČR a jeho nekrologu? Není to škoda?","I would not deal with the pages at all, but by the education of countries, the presentation of institutions and their ""marketing"". Desinnformators are quantum, but there is little about the EU. I looked at the site because I didn't know what Coreper II was. Whose representative for the Czech Republic was Martin Přítil, who received a honor yesterday. I found information about Coreeper II today on the website of the MFA of the Czech Republic and its obituar? Isn't that a shame?",opinion
mehr Hilfe bei Suchfunktion (automatische Vorschläge),More help with search function (automatic suggestions),search engine
Nee ik heb geen opmerking niet meer alleen dat ik wil dat ik nodig stop dat ze Poetin eindelijk straffen Maar ze laten hem gewoon lopen dat kan ik niet begrijpen,"No I no longer have a comment just that I want me to stop that they finally punish Putin, but they just let him walk that I can't understand that",comment
"Kompaktere aufmachung der Informationen, sonst schon ziemlich gut","Compact presentation of the information, otherwise pretty good",information
"Am primit o donație ,un ajutor de 25000€ nerambursabil și 25000€ cu împrumut fără dobândă pe 15 ani de la Ajutor Franța nerambursabil și Firma ajutoare Allocation familiale cu acte legale semnate și întocmite de ei și semnate ,trimise mie semnate și am ajuns până la rambursare ,zona clienți cu banca și pe urmă lucrurile au luat o întorsătură neașteptată și au pus tot felul de condiții și au dat alt act întocmit ,venit de la Comisia Europeană ,Structura financiară și economică,Serviciul de transfer international .Sfaturi de identificare Pop Elena , Obțineți suma de 3775€ , Garanția beneficiarului 385€ , Garanția alocației familiale 3990€ ,Suma totală de plătit 3775€ .Act emis în 28 decembrie 2022 .AK/2589654-07/07, Semnează director Jean-Claude Juncher. Trebuie pusă mâna pe ei sunt o bandă organizată formată din oameni capabili pentru că doamna care m a ajutat este lector universitar profesor universitar recunoscută la nivel mondial și am cercetat în timp să vedem ce se întâmplă am în jur de 100 de email uri de la acea doamnă de la firma respectivă care a fost foarte drăguță și actele sunt legale. Trebuie pusă mâna pe ei pentru că multe afaceri se fac în Franța în special cu bani nerambursabili de la uniunea europeană din bugetul uniunii europene și dacă ne axăm pe această problemă a mea veți vedea câți bani s au furat de această instituție. pe urmă sunt prinsă într un joc atâtea donații de la un spital și acel spital a fost a verișoarei mele 45% am și eu de acolo și am căzut pe mâna unor escroci unor oameni sus sus de tot puși și actele sunt pe numele meu toate legale verificate bătrânii dispar pentru că eu vorbesc cu ei pe cameră și ne scriem și ne am scris și dispar unul câte unul. Sunt sume enorme de bani și am plătit și notarul și avocatul pentru a intra banii în contul meu din România sau pentru a fi lăsați acolo și am pierdut mai mult de 6000 € și banii nu au intrat în contul meu. Rog să mi spuneți și să mi dați o adresă unde și cu cine pot lua legătura în acest sens. Doresc o adresă și o adresă de email. Pe urmă mai am verișoara mea decedată în 4 martie 2020 la spitalul militar Sfânta Maria din Londra și cadavrul este ascuns a ei a fost acel spital unde are 45%, dar cred că mai mult și nu am reușit să punem mâna pe ei și actele ei au fost făcute în timpul vieții prin Curtea supremă a regatului unit din Londra vă rog să îmi spuneți ce trebuie să fac ? Aștept răspunsul dumneavoastră cu mare nerăbdare. Sunt pensionară din învățământ profesor gimnazial am 70 de ani și sunt din România din județul Bistrița Năsăud orașul Năsăud și stau acum la țară în satul meu natal pentru că băiatul meu soția și nepoții au casă în spatele grădinii mele în spatele casei mele este un loc foarte frumos aici la Nepos 10 km de la Năsăud spre Ilva mică o zonă minunată și am o casă mare la Năsăud dar nu le place merg zilnic dar vin acasă la Nepos. Cu multă stimă și respect Elena Pop România 29 octombrie 2023","I received a donation, a help of € 25000 non -reimbursable and € 25000 with a 15 -year interest loan from help non -reimbursable and the Family Aid company with legal documents signed and drawn up by them and signed, sent to me and I reached until Refund, the clients area with the bank and then have taken an unexpected turn and put all kinds of conditions and gave another act prepared, coming from the European Commission, Financial and Economic Structure, International Transfer Service. Pop Identification Sumps Elena , Obtain the amount of € 3775, the beneficiary's guarantee 385 €, the guarantee of the family allowance 3990 €, the total amount to pay 3775 €. You have to put their hand on them are an organized band made up of capable people because the lady who helped me is a university professor lecturer recognized worldwide and I researched in time to see what happens I have around 100 email from that lady From the respective company that was very nice and the documents are legal. They should be put on them because many businesses are done in France especially with non -reimbursable money from the European Union from the European Union budget and if we focus on this issue you will see how much money they have stolen from this institution. Then I am caught in a game so many donations from a hospital and that hospital was of my cousin 45% I have from there and I fell into the hands of some people upstairs and the documents are on my name all legal Verified the elders disappear because I talk to them on the room and we write and we wrote and disappear one by one. There are huge amounts of money and I also paid the notary and the lawyer to enter my money in Romania or to be left there and I lost more than 6000 € and the money did not enter my account. Please tell me and give me an address where and with whom I can get in this regard. I wish an email address and address. Then I have my cousin who died on March 4, 2020 at the Saint Mary Military Hospital in London and the corpse is hidden of it was that hospital where it has 45%, but I think we could not get their hands on them and her documents were made during their lives through the Supreme Court of the UK in London please tell me what to do? I am waiting for your answer with great impatience. I am a pensioner from education teacher I am 70 years old and I am from Romania from Bistrița Năsăud County Năsăud and now stay in the country in my hometown because my boy's wife and grandchildren have a house behind my garden behind my house is a very place Beautiful here at Nepos 10 km from Năsăud to Ilva Mică a wonderful area and I have a big house in Năsăud but they do not like to go daily but come home to Nepos. With much esteem and respect Elena Pop Romania October 29, 2023",document
"For a High-school researcher like me, its perfect","For a High-school researcher like me, its perfect",opinion
Ok,Ok,nothing
va bene cosi,Okay so,nothing
Viac propagovat tuto stránku. Objavil som ju nahodne,To promote this page more. I discovered it randomly,opinion
Non,Non,nothing
Estoy muy agradecido por la información que disponen,I am very grateful for the information they have,information
"Laittamalla vain ne jotka menee oikeesti käsittelyyn,päivittämällä samoiseen alkuperäiseen jos laki tai muu direktiiviesitys käsitelty ja miten eli hyväksytty,hylätty ym","By putting only those who go for the right handling, upgrading to the same original if the law or other directive proposal was dealt with and how, ie accepted, abandoned etc.",opinion
Too soon for me to make any suggestions .,Too soon for me to make any suggestions .,suggestion
Its my first visit. All iz okay yet,Its my first visit. All iz okay yet,nothing
Brak uwag,Lack of comments,comment
No,No,nothing
"Vuestros informes deben de estar acompañados con más gráficos y entendibles (colores y el tipo de texto usan), a veces tengo la impresión que lo hacen para dificultar su entendimiento. Una imagen, vale por mil palabras.","Your reports must be accompanied with more graphics and understandable (colors and the type of text use), sometimes I have the impression that makes it difficult for their understanding. An image, is worth a thousand words.",document
"Melhorar o site e o deixar mais intuitivo e atraente a pessoas do ambiente escolar. Incluir videos e audios, deixar com a aparencia mais visual e atrativa ao público mais jovem, alias eles representam o nosso futuro a conscientização deste publico é fundamental","Improve the site and make it more intuitive and attractive to people in the school environment. Include videos and audios, leave with the more visual and attractive appearance to younger audiences, alias they represent our future the awareness of this audience is fundamental",opinion
Ggg,Ggg,nothing
No,No,nothing
"Protection from attacks cybercrime, propaganda, anticipate, anti-government, G8 tellorism group, high influence viruses population all","Protection from attacks cybercrime, propaganda, anticipate, anti-government, G8 tellorism group, high influence viruses population all",opinion
Wie bei der IT-Gesetzgebung soll die EU mit Fachbegriffen um sich werfen. Keine Simplifizierung nach unten der Sprache an durchschnittliche dumme EU-Subjekte sondern stets den Sinn nach hohem Niveau.,"As with IT legislation, the EU should throw technical terms around. No simplification down in the language of average stupid EU subjects but always the meaning at a high level.",translation
los colores,colors,website
1. Information should be honest and not propagandistic. 2. Facts should be easy to find.,1. Information should be honest and not propagandistic. 2. Facts should be easy to find.,information
Faciliter la connaissance des structures européennes par un large public,Facilitate knowledge of European structures by a large audience,opinion
"Good that you've got an Instagram profile, as this often seems to be lacking among political commissions and committees of the EU.","Good that you've got an Instagram profile, as this often seems to be lacking among political commissions and committees of the EU.",opinion
Thanks,Thanks,nothing
"The charts were excellent for observing trends. I am a photographer — the visual is important to me. I am also a writer and would have liked to be able to refer to tables with numbers. This is a well organized therefore useful web page. FYI: I live in France but I was born in Silicon Valley California, before it was that. I directed a public health project there after working as a photographer & copy writer in advertising. In all of those capacities I designed web pages. Yours was a pleasure to access. Thank you...jt","The charts were excellent for observing trends. I am a photographer — the visual is important to me. I am also a writer and would have liked to be able to refer to tables with numbers. This is a well organized therefore useful web page. FYI: I live in France but I was born in Silicon Valley California, before it was that. I directed a public health project there after working as a photographer & copy writer in advertising. In all of those capacities I designed web pages. Yours was a pleasure to access. Thank you...jt",opinion
Myślę że nie,I think not,nothing
Bisher nicht.,Not yet.,nothing
"I wanted to know how many representatives each country can send to the EU council and vote, I think I got my answer but this could have been a bit easier to find","I wanted to know how many representatives each country can send to the EU council and vote, I think I got my answer but this could have been a bit easier to find",opinion
"Website is in order but for foreign participants from other than Europe, few more special items can be introduced. No specialty in granting scholarships to Europeans only as it is evident to all of them. But to learn the methodology from other democratic nations will give a chance to learn and teach to others which will pave the way for larger development of humanity. If you wish any specific matter, I shall be pleased to write a detailed essay but now I am preoccupied with writing articles for my newspaper as I am to submit every fortnight a new topic.","Website is in order but for foreign participants from other than Europe, few more special items can be introduced. No specialty in granting scholarships to Europeans only as it is evident to all of them. But to learn the methodology from other democratic nations will give a chance to learn and teach to others which will pave the way for larger development of humanity. If you wish any specific matter, I shall be pleased to write a detailed essay but now I am preoccupied with writing articles for my newspaper as I am to submit every fortnight a new topic.",website
Nincsen.,Is not.,nothing
Out in evidente press relesse,Out in evidente press relesse,document
"No further comments, thank-you.","No further comments, thank-you.",comment
nessun suggerimento da dare,No suggestions to give,suggestion
Mniej propagandowych informacji,Less propaganda information,information
Not at this time.,Not at this time.,nothing
"es müsste mehr bürgerlicher werden, sodass es auch Menschern verstehen, die keine weitere Ausbildung nach ihrer Pflichtschule oder Lehre absolvierten.","It would have to become more bourgeois, so that it also understands people who did not complete any further training according to their compulsory school or teaching.",opinion
"Problém nie je vo webovom sídle Rady, problém je v samotných politikoch.","The problem is not in the website of the Council, the problem is in the politicians themselves.",website
neen,no,nothing
Não,No,nothing
No,No,nothing
En löytänyt edes tulevia puheenjohtajamaita listattuna...,I couldn't even find future presidency countries listed ...,document
"Por ahora, no.",Not for now.,nothing
No,No,nothing
nu,not,nothing
